<?xml version="1.0" encoding="utf-8"?>
<xs:schema xmlns:xs="http://www.w3.org/2001/XMLSchema" elementFormDefault="qualified" targetNamespace="http://www.uniovi.es" xmlns="http://www.uniovi.es">
	<xs:element name="rutas">
		<xs:complexType>
			<xs:sequence>
				<xs:element minOccurs="3" maxOccurs="unbounded" ref="ruta" />
			</xs:sequence>
		</xs:complexType>
	</xs:element>
	<xs:element name="ruta">
		<xs:complexType>
			<xs:sequence>
				<xs:element ref="nombre" />
				<xs:element ref="tipo" />
				<xs:element ref="transporte" />
				<xs:element minOccurs="0" maxOccurs="1" ref="fecha_incio" />
				<xs:element minOccurs="0" maxOccurs="1" ref="hora_inicio" />
				<xs:element ref="duracion" />
				<xs:element ref="agencia" />
				<xs:element ref="descripcion" />
				<xs:element ref="publico" />
				<xs:element ref="inicio" />
				<xs:element ref="direccion" />
				<xs:element ref="coordenadas" />
				<xs:element ref="referencias" />
				<xs:element ref="recomendacion" />
				<xs:element ref="hitos" />
				<xs:element ref="planimetria" />
				<xs:element ref="altimetria" />
			</xs:sequence>
		</xs:complexType>
	</xs:element>
	<xs:element name="nombre" type="xs:string" />
	<xs:element name="tipo" type="xs:string" />
	<xs:element name="transporte" type="xs:string" />
	<xs:element name="fecha_incio" type="xs:date" />
	<xs:element name="hora_inicio" type="xs:time" />
	<xs:element name="duracion">
		<xs:complexType>
			<xs:simpleContent>
				<xs:extension base="xs:float">
					<xs:attribute name="unidades" type="unidadesTiempo"  use="required" />
				</xs:extension>
			</xs:simpleContent>
		</xs:complexType>
	</xs:element>
	<xs:element name="agencia" type="xs:string" />
	<xs:element name="descripcion" type="xs:string" />
	<xs:element name="publico" type="xs:string" />
	<xs:element name="inicio" type="xs:string" />
	<xs:element name="direccion" type="xs:string" />
	<xs:element name="coordenadas">
		<xs:complexType>
			<xs:sequence>
				<xs:element ref="longitud" />
				<xs:element ref="latitud" />
				<xs:element ref="altitud" />
			</xs:sequence>
		</xs:complexType>
	</xs:element>
	<xs:element name="longitud">
		<xs:simpleType>
			<xs:restriction base="xs:double">
				<xs:minInclusive value="-90"></xs:minInclusive>
				<xs:maxInclusive value="90"></xs:maxInclusive>
			</xs:restriction>
		</xs:simpleType>
	</xs:element>
	<xs:element name="latitud">
		<xs:simpleType>
			<xs:restriction base="xs:double">
				<xs:minInclusive value="-90"></xs:minInclusive>
				<xs:maxInclusive value="90"></xs:maxInclusive>
			</xs:restriction>
		</xs:simpleType>
	</xs:element>
	<xs:element name="altitud">
		<xs:simpleType>
			<xs:restriction base="xs:integer">
				<xs:minInclusive value="0"></xs:minInclusive>
				<xs:maxExclusive value="8849"></xs:maxExclusive>
			</xs:restriction>
		</xs:simpleType>
	</xs:element>
	<xs:element name="referencias">
		<xs:complexType>
			<xs:sequence>
				<xs:element minOccurs="3" maxOccurs="unbounded" ref="referencia" />
			</xs:sequence>
		</xs:complexType>
	</xs:element>
	<xs:element name="referencia" type="xs:string" />
	<xs:element name="recomendacion" type="xs:string" />
	<xs:element name="hitos">
		<xs:complexType>
			<xs:sequence>
				<xs:element minOccurs="5" maxOccurs="unbounded" ref="hito" />
			</xs:sequence>
		</xs:complexType>
	</xs:element>
	<xs:element name="hito">
		<xs:complexType>
			<xs:sequence>
				<xs:element ref="nombre" />
				<xs:element ref="descripcion" />
				<xs:element ref="coordenadas" />
				<xs:element ref="distancia" />
				<xs:element ref="imagenes" />
				<xs:element minOccurs="0" maxOccurs="1" ref="videos" />
			</xs:sequence>
		</xs:complexType>
	</xs:element>
	<xs:element name="distancia">
		<xs:complexType>
			<xs:simpleContent>
				<xs:extension base="xs:float">
					<xs:attribute name="unidades" type="xs:string" use="required" />
				</xs:extension>
			</xs:simpleContent>
			
		</xs:complexType>
	</xs:element>
	<xs:element name="imagenes">
		<xs:complexType>
			<xs:sequence>
				<xs:element minOccurs="1" maxOccurs="5" ref="imagen" />
			</xs:sequence>
		</xs:complexType>
	</xs:element>
	<xs:element name="imagen" type="xs:string" />
	<xs:element name="videos">
		<xs:complexType>
			<xs:sequence>
				<xs:element minOccurs="0" maxOccurs="3" ref="video" />
			</xs:sequence>
		</xs:complexType>
	</xs:element>
	<xs:element name="video" type="xs:string" />
	<xs:element name="planimetria" type="xs:string" />
	<xs:element name="altimetria" type="xs:string" />


	<xs:simpleType name="unidadesTiempo">
		<xs:restriction base="xs:string">
			<xs:enumeration value="horas"/>
			<xs:enumeration value="días"/>
			<xs:enumeration value="semanas"/>
			<xs:enumeration value="hora"/>
			<xs:enumeration value="día"/>
			<xs:enumeration value="semana"/>
			<xs:enumeration value="minutos"/>
		</xs:restriction>
	</xs:simpleType>

	<xs:notation name="png" public="" system="image/png" />
	<xs:notation name="mp4" public="" system="video/mp4" />
</xs:schema>